{
  "id": "unity-small-finance-bank",
  "name": "Unity Small Finance Bank",
  "short_name": "Unity SFB",
  "legal_name": "Unity Small Finance Bank Limited",
  "categories": [
    "small-finance-bank"
  ],
  "logos": {
    "full": "full.svg",
    "icon": "icon.svg",
    "mono_dark": null,
    "mono_light": null
  },
  "brand_color": "#003087",
  "country": "IN",
  "founded": 2021,
  "regulated_by": [
    "RBI"
  ],
  "ifsc_prefix": "UNTY",
  "upi_handles": [],
  "website": "https://unitysb.com",
  "status": "active",
  "tags": [
    "sfb"
  ],
  "added_at": "2025-08-05",
  "updated_at": "2025-08-05"
}