{
  "id": "cashfree-payments",
  "name": "Cashfree Payments",
  "short_name": "Cashfree",
  "legal_name": "Cashfree Payments India Private Limited",
  "categories": [
    "payment-gateway",
    "infra-api"
  ],
  "logos": {
    "full": "full.svg",
    "icon": "icon.svg",
    "mono_dark": null,
    "mono_light": null
  },
  "brand_color": "#1A55E3",
  "country": "IN",
  "founded": 2015,
  "regulated_by": [
    "RBI"
  ],
  "website": "https://www.cashfree.com",
  "status": "active",
  "tags": [
    "b2b",
    "payment-aggregator",
    "pa-license"
  ],
  "added_at": "2025-08-05",
  "updated_at": "2025-08-05"
}